<?xml version="1.0"?>
<!--
/**
 * Copyright Â© Magento, Inc. All rights reserved.
 * See COPYING.txt for license details.
 */
-->
<xs:schema attributeFormDefault="unqualified" elementFormDefault="qualified" xmlns:xs="http://www.w3.org/2001/XMLSchema">
    <xs:element name="config">
        <xs:complexType>
            <xs:sequence>
                <xs:element name="groups">
                    <xs:complexType>
                        <xs:sequence>
                            <xs:element name="group" minOccurs="0" maxOccurs="unbounded">
                                <xs:complexType>
                                    <xs:sequence>
                                        <xs:element type="xs:string" name="label"/>
                                    </xs:sequence>
                                    <xs:attribute type="xs:string" name="name" use="optional"/>
                                    <xs:attribute type="xs:string" name="translate" use="optional"/>
                                    <xs:attribute type="xs:byte" name="sortOrder" use="optional"/>
                                </xs:complexType>
                            </xs:element>
                        </xs:sequence>
                    </xs:complexType>
                </xs:element>
                <xs:element name="content_types">
                    <xs:complexType>
                        <xs:sequence>
                            <xs:element name="type" minOccurs="0" maxOccurs="unbounded">
                                <xs:complexType>
                                    <xs:all>
                                        <xs:element type="xs:string" name="label"/>
                                        <xs:element type="xs:string" name="icon"/>
                                        <xs:element type="xs:string" name="component" minOccurs="0"/>
                                        <xs:element type="xs:string" name="preview_template" minOccurs="0"/>
                                        <xs:element type="xs:string" name="render_template" minOccurs="0"/>
                                        <xs:element type="xs:string" name="preview_component" minOccurs="0"/>
                                        <xs:element type="xs:string" name="backend_block" minOccurs="0"/>
                                        <xs:element type="xs:string" name="backend_template" minOccurs="0"/>
                                        <xs:element type="xs:string" name="form"/>
                                        <xs:element type="xs:string" name="group"/>
                                        <xs:element type="xs:string" name="allowed_parents" minOccurs="0"/>
                                        <xs:element type="readers" name="readers" minOccurs="1"/>
                                        <xs:element name="appearances" minOccurs="0" maxOccurs="1">
                                            <xs:complexType>
                                                <xs:sequence>
                                                    <xs:element type="appearance" name="appearance" minOccurs="1" maxOccurs="unbounded"/>
                                                </xs:sequence>
                                            </xs:complexType>
                                        </xs:element>
                                        <xs:element type="xs:string" name="is_visible" minOccurs="0"/>
                                    </xs:all>
                                    <xs:attribute type="xs:string" name="name" use="required"/>
                                    <xs:attribute type="xs:string" name="translate" use="required"/>
                                    <xs:attribute type="xs:byte" name="sortOrder" use="optional"/>
                                </xs:complexType>
                            </xs:element>
                        </xs:sequence>
                    </xs:complexType>
                </xs:element>
            </xs:sequence>
        </xs:complexType>
    </xs:element>
    <xs:complexType name="appearance">
        <xs:sequence>
            <xs:element name="data" minOccurs="0" maxOccurs="unbounded">
                <xs:complexType>
                    <xs:simpleContent>
                        <xs:extension base="xs:string">
                            <xs:attribute type="xs:string" name="name"/>
                        </xs:extension>
                    </xs:simpleContent>
                </xs:complexType>
            </xs:element>
            <xs:element type="xs:string" name="preview_template" minOccurs="0"/>
            <xs:element type="xs:string" name="render_template" minOccurs="0"/>
            <xs:element type="readers" name="readers" minOccurs="0"/>
        </xs:sequence>
        <xs:attribute type="xs:string" name="name" use="required"/>
    </xs:complexType>
    <xs:complexType name="readers">
        <xs:sequence>
            <xs:element type="reader" name="reader" minOccurs="1" maxOccurs="unbounded"/>
        </xs:sequence>
    </xs:complexType>
    <xs:complexType name="reader">
        <xs:attribute type="xs:string" name="name" use="required"/>
        <xs:attribute type="xs:string" name="component" use="required"/>
    </xs:complexType>
</xs:schema>
